id,title,type,description,release_year,age_certification,runtime,genres,production_countries,seasons,imdb_id,imdb_score,imdb_votes,tmdb_popularity,tmdb_score
tm1080335,Blush,MOVIE,"When a horticulturalist-astronaut crashes onto a desolate planet, he encounters an ethereal visitor and discovers the joy of building a new life—realizing the universe has delivered something astonishing.",2021,,11,"['animation', 'scifi']","['ES', 'US']",,tt14460998,8.0,,10.41,7.9
ts308015,Wolfboy and The Everything Factory,SHOW,"William Wolfe is no ordinary human boy. Down in the magical spryte realm of the Everything Factory, he’s Wolfboy. And with his new spryte friends, he learns his vivid imagination and limitless creativity have the power to change the world.",2021,TV-Y7,12,"['animation', 'comedy', 'family', 'fantasy']",['US'],2.0,tt15389676,7.7,178.0,9.072,8.0
ts328195,Pretzel and the Puppies,SHOW,"Meet Pretzel, the world’s longest dachshund and a playful, supportive dad to five frisky puppies. Together with his wife, Greta, they encourage their pups to get their paws up to solve problems and “make their bark” on the world.",2022,TV-Y,23,"['animation', 'family']","['CA', 'US']",2.0,tt17524490,7.7,58.0,8.182,7.3
tm1183175,"Snoopy Presents: It’s the Small Things, Charlie Brown",MOVIE,"Charlie Brown is determined to win the big baseball game. But things turn into a fiasco right before the matchup, when Sally bonds with a little flower on the pitcher’s mound and vows to protect it at all costs.",2022,,38,"['animation', 'family']","['US', 'CA']",,tt19316654,6.7,224.0,7.889,7.0
ts364251,Interrupting Chicken,SHOW,"A young little chicken named Piper has a habit of interrupting storytime! Every time Piper hears a story, she can’t help but jump in, ask questions and let her imagination run wild as she tries to fill in details, guess what happens next or insert herself in the middle of the action to help save the day.",2022,TV-Y,12,"['animation', 'family']",['US'],1.0,tt21942798,6.4,30.0,6.576,6.0
ts308044,Get Rolling with Otis,SHOW,"Welcome to Long Hill Dairy Farm, home to Otis the tractor and all his friends. Otis may be little, but he has a big heart. Whenever he sees a friend in need, he hits the brakes to see what’s wrong and rolls into action to help.",2021,TV-Y,12,"['animation', 'comedy', 'family']",['IE'],2.0,tt15389898,8.3,55.0,6.417,6.5
tm1183293,"Snoopy Presents: To Mom (and Dad), With Love",MOVIE,"Mother’s Day is almost here, and the gang is excited—except Peppermint Patty. For her, it’s a reminder that she didn’t grow up with a mom. But good pal Marcie helps Peppermint Patty see that families come in all shapes and sizes.",2022,G,38,"['animation', 'comedy', 'family']","['US', 'CA']",,tt19866966,7.1,185.0,5.206,5.9
ts342889,Pinecone & Pony,SHOW,"Based on Kate Beaton’s children’s picture book “The Princess and the Pony,” Pinecone & Pony is an adventure led by two independent warriors who are fearlessly themselves.",2022,TV-Y,11,"['family', 'fantasy', 'animation', 'comedy']",['CA'],2.0,tt18830366,6.4,117.0,5.051,2.0
ts350479,Sago Mini Friends,SHOW,"Welcome to Sagoville, where Harvey loves to play and discover ways to have silly fun! He and his closest friends explore, imagine, and express true thankfulness for all things, big and small, through creative adventures and unforgettable songs.",2022,TV-Y,11,"['animation', 'comedy', 'family']",['US'],1.0,tt19770764,8.5,33.0,4.947,6.0
ts113822,Duck & Goose,SHOW,"Feathered friends Duck and Goose couldn’t be more different, but in this preschool show, they learn how to bring out the best in one another. Based on books by Tad Hills.",2022,TV-Y,0,"['animation', 'family']",['US'],1.0,tt7999864,7.9,37.0,3.945,2.0
ts320389,El Deafo,SHOW,"Going to school and making new friends can be tough. Having to do both while wearing a bulky hearing aid on your chest? That takes superpowers! With a little help from her superhero alter ego, El Deafo, Cece learns to embrace her differences.",2022,TV-G,26,"['comedy', 'family', 'animation']",['US'],1.0,tt16432198,8.4,111.0,3.473,5.0
ts364250,Slumberkins,SHOW,"Embark on adventures with Bigfoot, Unicorn, Sloth, Yak, and Fox as they explore a world of feelings in this Jim Henson Company series that brings the emotional learning of Slumberkins to life.",2022,TV-Y,0,"['fantasy', 'animation', 'comedy', 'family']",['US'],1.0,tt21942724,9.5,62.0,3.36,
tm1129563,Mariah's Christmas: The Magic Continues,MOVIE,"The Queen of Christmas returns with a blast of holiday cheer in this special. Mariah performs her enchanting original song “Fall in Love at Christmas” with Khalid and Kirk Franklin, chats with Apple Music’s Zane Lowe, and signs off with a festive classic.",2021,G,18,"['music', 'family']",['US'],,tt15829598,4.9,216.0,3.318,4.833
ts314105,Shrinking,SHOW,"Jimmy is struggling to grieve the loss of his wife while being a dad, friend, and therapist. He decides to try a new approach with everyone in his path: unfiltered, brutal honesty. Can he help himself by helping others? Will it bring him back into the light?",2023,TV-MA,55,"['comedy', 'drama']",['US'],1.0,tt15677150,7.9,13799.0,83.362,7.7
ts288980,Hello Tomorrow!,SHOW,"In a retro-future world, a group of traveling salesmen hawk lunar timeshares. Among them is Jack, a salesman of great talent and ambition, whose unshakeable faith in a brighter tomorrow inspires his coworkers, revitalizes his desperate customers but threatens to leave him dangerously lost in the very dream that sustains him.",2023,TV-MA,0,"['drama', 'scifi', 'comedy']",['US'],1.0,tt14596212,6.3,1562.0,51.315,6.8
tm1003483,Sharper,MOVIE,"Motivations are suspect, and expectations are turned chaos, as a con artist takes on Manhattan billionaires.",2023,R,116,"['crime', 'drama', 'thriller']",['US'],,tt12573454,6.6,13245.0,161.468,7.126
ts328281,Dear Edward,SHOW,"A 12-year-old boy survives a plane crash that kills every other passenger on the flight, including his family. As he and others affected by the tragedy try to make sense of what happened, unexpected friendships, romances, and communities are formed.",2023,TV-MA,0,['drama'],['US'],1.0,tt17543896,7.4,1324.0,37.81,2.0
ts316895,The Reluctant Traveler with Eugene Levy,SHOW,Award-winning actor and nervous explorer Eugene Levy steps out of his comfort zone for a whirlwind tour of the world’s most beautiful and intriguing destinations.,2023,TV-PG,35,"['documentation', 'reality']",['GB'],1.0,tt15822846,7.8,473.0,13.892,6.8
ts296808,Liaison,SHOW,"This contemporary thriller explores how past mistakes have the potential to destroy the future. It blends action with an unpredictable plot in which espionage and political intrigue play out against a story of passionate, enduring love.",2023,TV-MA,51,"['crime', 'thriller']","['FR', 'GB']",1.0,tt14792896,6.3,549.0,84.911,6.1
ts374301,Super League: The War For Football,SHOW,"The past, present, and future of European football collide when plans for a breakaway league emerge, leaving the game’s most powerful leaders to defend—or upend—the traditions of the sport.",2023,TV-MA,0,"['documentation', 'sport']",['US'],1.0,tt24587530,7.4,414.0,6.8,6.7
ts377681,Shape Island,SHOW,"On a charming island, Square, Triangle, and Circle seek adventure and connection while learning how to navigate each other’s differences. Based on the internationally best-selling books by Mac Barnett and Jon Klassen.",2023,TV-G,24,"['family', 'animation', 'fantasy', 'comedy']",['US'],1.0,tt25515858,7.6,121.0,18.529,9.2
