id,title,type,description,release_year,age_certification,runtime,genres,production_countries,seasons,imdb_id,imdb_score,imdb_votes,tmdb_popularity,tmdb_score
ts251336,Echo 3,SHOW,"When brilliant scientist Amber Chesborough vanishes along the Colombia-Venezuela border, her brother and her husband—both elite U.S. Army commandos—struggle to find her amid a guerilla war, discovering that the woman they love might have a secret.",2022,TV-MA,58,"['drama', 'action', 'thriller']","['US', 'CO']",1.0,tt12762512,6.5,7783.0,131.222,7.229
tm983754,CODA,MOVIE,"As a CODA (Child of Deaf Adults), Ruby is the only hearing person in her deaf family. When the family's fishing business is threatened, Ruby finds herself torn between pursuing her love of music and her fear of abandoning her parents.",2021,PG-13,112,"['drama', 'comedy', 'music']","['US', 'FR']",,tt10366460,8.0,140450.0,32.914,8.01
tm1264797,"The Boy, the Mole, the Fox and the Horse",MOVIE,"The unlikely friendship of a boy, a mole, a fox and a horse traveling together in the boy’s search for home.",2022,G,34,"['family', 'action', 'fantasy', 'animation', 'drama', 'comedy']","['GB', 'US']",,tt22667880,7.9,8435.0,35.916,8.61
ts106816,Pachinko,SHOW,"Based on the New York Times bestseller, this sweeping saga chronicles the hopes and dreams of a Korean immigrant family across four generations as they leave their homeland in an indomitable quest to survive and thrive.",2022,TV-MA,55,['drama'],['US'],2.0,tt8888462,8.4,9509.0,29.38,8.167
ts221142,The Mosquito Coast,SHOW,Allie Fox—a brilliant inventor and stubborn idealist—uproots his family for a dangerous quest through Mexico to flee the U.S. government and find safety.,2021,TV-MA,47,"['drama', 'action', 'thriller']",['MX'],2.0,tt11041132,6.8,14137.0,30.57,6.974
ts200606,Shantaram,SHOW,"Escaped convict Lin Ford flees to the teeming streets of 1980s Bombay, looking to disappear. Working as a medic for the city’s poor and neglected, Lin finds unexpected love, connection, and courage on the long road to redemption.",2022,TV-MA,52,"['action', 'crime', 'drama', 'thriller']",['AU'],1.0,tt0429087,7.5,11865.0,56.545,8.2
ts238623,WeCrashed,SHOW,"The greed-filled rise and inevitable fall of WeWork, one of the world's most valuable startups, and the narcissists whose chaotic love made it all possible.",2022,TV-MA,53,['drama'],['US'],1.0,tt12005128,7.3,16843.0,30.263,7.6
ts346042,Loot,SHOW,"After divorcing her husband of 20 years, Molly Novak must figure out what to do with her $87 billion settlement. She decides to reengage with her charitable foundation and reconnect with the real world—finding herself along the way.",2022,TV-MA,27,['comedy'],['US'],1.0,tt14271498,6.7,8310.0,10.316,7.244
ts288676,The Problem With Jon Stewart,SHOW,"It's easy to feel overwhelmed by the world's problems. It's harder to pinpoint the systems responsible for creating them. In this series, Jon Stewart brings together people impacted by different parts of a problem to discuss how we come up with change.",2021,TV-MA,46,['comedy'],['US'],2.0,tt15084142,7.1,1934.0,5.743,7.5
ts251564,The Afterparty,SHOW,"When a high school reunion’s afterparty ends in a stunning death, everyone is a suspect. A detective grills the former classmates one by one, uncovering potential motives as each tells their version of the story—culminating in the shocking truth.",2022,TV-MA,35,"['thriller', 'comedy', 'crime']",['US'],2.0,tt12614214,7.2,13154.0,15.767,7.7
ts224998,Schmigadoon!,SHOW,"In this parody of 1940s musicals, backpacking couple Melissa and Josh get trapped in Schmigadoon, a magical town filled with singing and dancing townspeople, and learn they can't leave without finding true love—which they thought they already had.",2021,TV-14,30,"['comedy', 'fantasy', 'romance']",['CA'],2.0,tt13126498,7.3,10366.0,12.248,7.282
ts309881,Acapulco,SHOW,"Twenty-something Máximo Gallardo's dreams comes true when he gets the job of a lifetime as a cabana boy at the hottest resort in Acapulco. He soon realizes the job is far more complicated than he ever imagined and in order to succeed, he must learn to navigate a demanding clientele, a mercurial mentor, and a complicated home life, without losing his way to shortcuts or temptations.",2021,TV-14,29,['comedy'],['MX'],2.0,tt13567344,7.7,5337.0,82.466,7.3
ts253142,Five Days at Memorial,SHOW,"Based on actual events from Hurricane Katrina. When the floodwaters rose, power failed, and heat soared, exhausted caregivers at a New Orleans hospital were forced to make profound, heart-wrenching decisions.",2022,TV-MA,47,['drama'],['US'],1.0,tt3283594,7.7,11421.0,45.817,7.988
tm1187561,The Greatest Beer Run Ever,MOVIE,"Chickie wants to support his friends fighting in Vietnam, so he does something wild—personally bring them American beer. What starts as a well-meaning journey quickly changes Chickie’s life and perspective. Based on a true story.",2022,R,126,"['drama', 'war', 'comedy']",['US'],,tt10268488,6.8,20125.0,38.801,7.749
ts343868,Prehistoric Planet,SHOW,"Experience the wonders of our world like never before in this epic docuseries from Jon Favreau and the producers of Planet Earth. Travel back 66 million years to when majestic dinosaurs and extraordinary creatures roamed the lands, seas, and skies.",2022,TV-PG,41,"['documentation', 'history', 'animation']",['GB'],1.0,tt10324164,8.5,8392.0,58.814,8.381
tm1164256,Spirited,MOVIE,"Each Christmas Eve, the Ghost of Christmas Present selects one dark soul to be reformed by a visit from three spirits. But this season, he picked the wrong Scrooge. Clint Briggs turns the tables on his ghostly host until Present finds himself reexamining his own past, present and future.",2022,PG-13,127,"['comedy', 'family']",['US'],,tt10999120,6.6,40840.0,55.481,7.0
tm1180268,Raymond & Ray,MOVIE,"Half brothers Raymond and Ray reunite when their estranged father dies—and discover that his final wish was for them to dig his grave. Together, they process who they’ve become as men, both because of their father and in spite of him.",2022,R,106,"['drama', 'comedy']","['US', 'GB']",,tt15334032,6.2,6264.0,19.669,6.8
tm1255679,Selena Gomez: My Mind & Me,MOVIE,"After years in the limelight, Selena Gomez achieves unimaginable stardom. But just as she reaches a new peak, an unexpected turn pulls her into darkness. This uniquely raw and intimate documentary spans her six-year journey into a new light.",2022,R,95,"['music', 'documentation']",['US'],,tt21819250,7.4,4944.0,64.756,8.288
ts251525,Shining Girls,SHOW,"Years after a brutal attack left her in a constantly shifting reality, Kirby Mazrachi learns that a recent murder is linked to her assault. She teams with veteran reporter Dan Velazquez to understand her ever-changing present—and confront her past.",2022,TV-MA,49,"['drama', 'scifi', 'thriller', 'crime']",['US'],1.0,tt2953250,7.4,15871.0,29.351,7.883
tm413096,Finch,MOVIE,"On a post-apocalyptic Earth, a robot, built to protect the life of his dying creator's beloved dog, learns about life, love, friendship, and what it means to be human.",2021,PG-13,115,"['scifi', 'drama']","['IN', 'US']",,tt3420504,6.9,86229.0,94.798,7.99
ts289342,Invasion,SHOW,Earth is visited by an alien species that threatens humanity's existence. Events unfold in real time through the eyes of five ordinary people across the globe as the struggle to make sense of the chaos unraveling around them,2021,TV-MA,51,"['scifi', 'drama', 'fantasy']",['US'],1.0,tt9737326,6.0,29189.0,68.953,7.245
ts314448,Roar,SHOW,"Featuring an all-star cast, this genre-bending anthology series weaves together eight darkly comedic feminist fables that take unexpected approaches to subjects like gender roles, autonomy, and identity.",2022,TV-MA,32,"['drama', 'comedy']",['US'],2.0,tt14161704,5.6,2739.0,13.327,6.1
tm1187578,Emancipation,MOVIE,"Inspired by the gripping true story of a man who would do anything for his family—and for freedom. When Peter, an enslaved man, risks his life to escape and return to his family, he embarks on a perilous journey of love and endurance.",2022,R,132,"['drama', 'thriller', 'action']",['US'],,tt12530246,6.1,21286.0,226.666,8.059
ts272733,Make or Break,SHOW,"From pure elation to devastating heartbreak, follow the world's best surfers as they fight for the championship title.",2022,TV-MA,40,"['documentation', 'sport']",['GB'],2.0,tt13773908,7.8,257.0,29.282,4.5
ts252747,The Essex Serpent,SHOW,"London widow Cora Seaborne moves to Essex to investigate reports of a mythical serpent. She forms an unlikely bond with the village vicar, but when tragedy strikes, locals accuse her of attracting the creature.",2022,TV-14,48,"['drama', 'history', 'fantasy']",['GB'],1.0,tt12976224,6.3,6056.0,9.504,7.2
ts296186,Surface,SHOW,A traumatic head injury leaves Sophie with extreme memory loss. In her quest to put the pieces of her life back together—with help from her husband and friends—Sophie begins to question the truth behind her picture-perfect life.,2022,TV-MA,0,"['drama', 'thriller']",['US'],1.0,tt13694702,6.3,3962.0,16.104,6.3
tm1137983,Cha Cha Real Smooth,MOVIE,"Fresh out of college and stuck at his New Jersey home without a clear path forward, 22-year-old Andrew begins working as a party starter for bar/bat mitzvahs—where he strikes up a unique friendship with a young mom and her teenage daughter.",2022,R,108,"['drama', 'comedy']",['US'],,tt14376344,7.3,21164.0,16.179,7.2
ts236914,The Shrink Next Door,SHOW,"Inspired by the true story of Marty and the therapist who turned his life around...then took it over. When he first meets Dr. Ike, Marty just wants to get better at boundaries. Over 30 years, he'll learn all about them—and what happens when they get crossed.",2021,TV-MA,43,"['drama', 'comedy']",['US'],1.0,tt11947248,7.1,13717.0,12.148,7.462
ts286752,Now and Then,SHOW,"On the eve of college graduation, six best friends embark on an epic weekend to celebrate—but it takes a fatal turn. Nearly 20 years later, the survivors are reluctantly reunited by a blackmail text threatening to expose the truth about that fateful night.",2022,TV-MA,54,"['drama', 'thriller', 'crime']",['ES'],1.0,tt14509156,5.6,845.0,7.812,6.3
tm466906,Luck,MOVIE,"Suddenly finding herself in the never-before-seen Land of Luck, the unluckiest person in the world must unite with the magical creatures there to turn her luck around.",2022,G,105,"['fantasy', 'animation', 'comedy', 'family']","['ES', 'US']",,tt7214954,6.4,21308.0,270.029,7.9
ts273314,Physical,SHOW,"Sheila Rubin is a quietly tormented housewife in ’80s San Diego. Behind closed doors, she battles extreme personal demons and a vicious inner voice. But things change when she discovers aerobics, sparking a journey toward empowerment and success.",2021,TV-MA,29,"['drama', 'comedy']",['US'],2.0,tt11828492,7.3,9972.0,19.914,6.5
ts360077,Gutsy,SHOW,Take an unforgettable journey with Hillary and Chelsea Clinton as they go on adventures with some of the world’s boldest and bravest women—from household names to unsung heroes—who make us laugh and inspire us to be more gutsy.,2022,TV-PG,0,['documentation'],['US'],1.0,tt13655266,4.0,1020.0,2.994,6.0
tm1035207,The Tragedy of Macbeth,MOVIE,"Macbeth, the Thane of Glamis, receives a prophecy from a trio of witches that one day he will become King of Scotland. Consumed by ambition and spurred to action by his wife, Macbeth murders his king and takes the throne for himself.",2021,R,105,"['drama', 'thriller', 'war', 'history', 'comedy', 'romance', 'action']",['US'],,tt10095582,7.1,35765.0,18.643,6.958
ts271337,The Last Days of Ptolemy Grey,SHOW,"Suddenly left without his trusted caretaker, Ptolemy Grey is assigned to the care of orphaned teenager Robyn. When they learn about a treatment that will restore Ptolemy’s dementia-addled memories, it begins a journey toward shocking truths.",2022,TV-MA,52,['drama'],['US'],1.0,tt13820498,7.8,4887.0,9.313,8.0
ts226608,Suspicion,SHOW,"Five ordinary Brits are accused of kidnapping the son of a prominent U.S. media mogul. They embark on a desperate race against time to prove their innocence, but will anyone believe them—and are they telling the truth?",2022,TV-MA,46,"['drama', 'crime', 'thriller']",['GB'],1.0,tt12026710,6.2,8268.0,13.428,7.157
ts366512,Circuit Breakers,SHOW,"Follow the futuristic anthology as it tackles children's issues through a sci-fi lens. But not everything is what it seems, and their curiosity leads to chaos.",2022,TV-G,25,"['family', 'scifi']",['US'],1.0,tt21942776,5.4,176.0,7.177,7.7
ts282250,Calls,SHOW,"Told through a series of interconnected phone conversations, this groundbreaking series chronicles the mysterious story of a group of strangers whose lives are thrown into disarray in the lead-up to an apocalyptic event.",2021,TV-MA,16,"['thriller', 'drama', 'scifi', 'horror', 'animation']",['US'],1.0,tt9327706,7.7,6050.0,14.767,7.01
ts330311,The Big Conn,SHOW,"The unbelievable true story of the larger-than-life attorney, Eric C. Conn, who defrauded the government over half a billion dollars in the largest Social Security fraud case in history.",2022,TV-MA,57,"['documentation', 'crime']",['US'],1.0,tt18265020,7.1,708.0,3.551,6.5
tm937920,Billie Eilish: The World's a Little Blurry,MOVIE,"This documentary offers a deeply intimate look at extraordinary teenager Billie Eilish. Award-winning filmmaker R.J. Cutler follows her journey on the road, onstage, and at home with her family as the writing and recording of her debut album changes her life.",2021,R,140,"['music', 'documentation']",['US'],,tt11459366,7.7,8183.0,12.017,8.5
ts328446,They Call Me Magic,SHOW,"Earvin “Magic” Johnson is an icon for the ages—from humble beginnings to the Dream Team to business titan. Featuring candid interviews with teammates, rivals, family, friends, and more, this docuseries charts the life and career of a legend.",2022,TV-MA,60,"['documentation', 'sport']",['US'],1.0,tt17736322,7.7,1228.0,4.797,7.5
ts317498,The Line,SHOW,"In covert modern warfare, the line between right and wrong has blurred. This docuseries examines the moral ambiguities of war as embodied by the 2018 case in which a U.S. Navy SEAL platoon accused its chief, Eddie Gallagher, of war crimes.",2021,TV-MA,56,"['war', 'documentation', 'crime']",['US'],1.0,tt14475988,7.7,941.0,4.411,8.0
ts189056,Lisey's Story,SHOW,"A widow becomes the object of a dangerous stalker, obsessed with her husband's work.",2021,TV-MA,50,"['horror', 'thriller', 'drama', 'scifi', 'fantasy']",['US'],1.0,tt10151848,5.9,4987.0,11.835,6.1
tm1093800,Come from Away,MOVIE,"7,000 passengers are stranded in the small town of Gander, Newfoundland after all flights into the US are grounded on September 11, 2001. Filmed live on stage at the Gerald Schoenfeld Theater in New York City.",2021,PG-13,107,"['comedy', 'drama']","['CA', 'US']",,tt7638556,8.6,2383.0,3.941,7.9
tm1239630,Sidney,MOVIE,"This revealing documentary honors the legendary Sidney Poitier—iconic actor, filmmaker, and civil rights activist. Featuring interviews with Denzel Washington, Spike Lee, Halle Berry, and more.",2022,PG-13,106,['documentation'],['US'],,tt16977750,7.8,916.0,6.231,7.95
ts237871,Fraggle Rock: Back to the Rock,SHOW,"Join Gobo, Red, Wembley, Mokey, Boober, and new Fraggle friends on hilarious, epic adventures about the magic that happens when we celebrate and care for our interconnected world.",2022,TV-G,27,"['animation', 'comedy', 'family']","['CA', 'US']",1.0,tt12397680,8.1,370.0,8.06,8.889
tm984163,Palmer,MOVIE,"After 12 years in prison, former high school football star Eddie Palmer returns home to put his life back together—and forms an unlikely bond with Sam, an outcast boy from a troubled home. But Eddie's past threatens to ruin his new life and family.",2021,R,110,['drama'],['US'],,tt6857376,7.2,37016.0,16.279,8.0
ts287796,The Me You Can't See,SHOW,Oprah Winfrey and Prince Harry join forces to guide honest discussions about mental health.,2021,TV-MA,62,['documentation'],['US'],1.0,tt14584186,5.5,1906.0,5.172,9.5
ts287281,1971: The Year That Music Changed Everything,SHOW,"An immersive, deep-dive docuseries rich with archival footage and interviews that explores the musicians and soundtracks that shaped the culture and politics of 1971.",2021,TV-MA,45,"['documentation', 'history', 'music']",['US'],1.0,tt14544732,7.6,1470.0,4.849,7.6
ts288083,Watch the Sound with Mark Ronson,SHOW,"Oscar and Grammy Award-winning producer and artist Mark Ronson explores the intersection of technology and musical innovation with his heroes and fellow hitmakers—including Paul McCartney, DJ Premier, Charli XCX, Dave Grohl, and Questlove.",2021,,35,"['documentation', 'music']",['US'],1.0,tt14482570,8.0,713.0,5.754,7.857
tm1247677,Louis Armstrong's Black & Blues,MOVIE,"An intimate and revealing look at the world-changing musician, presented through a lens of archival footage and never-before-heard home recordings and personal conversations. This definitive documentary honors Armstrong's legacy as a founding father of jazz, one of the first internationally known and beloved stars, and a cultural ambassador of the United States.",2022,R,104,"['documentation', 'music']",['US'],,tt14447458,7.3,490.0,4.417,7.0
tm470776,Cherry,MOVIE,"Cherry drifts from college dropout to army medic in Iraq - anchored only by his true love, Emily. But after returning from the war with PTSD, his life spirals into drugs and crime as he struggles to find his place in the world.",2021,R,140,"['drama', 'crime']",['US'],,tt9130508,6.6,33705.0,25.895,7.4
ts94707,Dr. Brain,SHOW,"An emotional journey that follows a brain scientist who is obsessive about figuring out new technologies to access the consciousness and memories of the brain. His life goes sideways when his family falls victim to a mysterious accident, and  he uses his skills to access memories from his wife’s brain to piece together the mystery of what actually happened to his family and why.",2021,TV-MA,57,"['thriller', 'drama', 'scifi']",['KR'],1.0,tt15758760,6.7,2545.0,23.186,7.574
ts221207,Mr. Corman,SHOW,A deep cut into the days and nights of a public schoolteacher in the San Fernando Valley.,2021,TV-MA,29,"['comedy', 'drama']",['US'],1.0,tt10971064,6.5,5544.0,9.871,6.571
tm947517,The Velvet Underground,MOVIE,"Experience the iconic rock band's legacy in the first major documentary to tell their story. Directed with the era’s avant-garde spirit by Todd Haynes, this kaleidoscopic oral history combines exclusive interviews with dazzling archival footage.",2021,R,121,"['documentation', 'music']",['US'],,tt7230750,7.4,4572.0,7.777,6.8
tm995088,The Sky Is Everywhere,MOVIE,"Lennie is a teen musical prodigy grieving the death of her sister when she finds herself caught between a new guy at school and her sister's devastated boyfriend. Through her vivid imagination and conflicted heart, Lennie navigates first love and first loss.",2022,PG-13,103,"['drama', 'romance', 'music']",['US'],,tt2201261,5.6,1436.0,15.347,5.6
tm1125299,Swan Song,MOVIE,"In the near future, Cameron Turner is diagnosed with a terminal illness. Presented with an experimental solution to shield his wife and son from grief, he grapples with altering their fate.",2021,R,112,"['drama', 'romance', 'scifi']",['US'],,tt13207508,6.8,15083.0,17.465,7.3
tm1035374,Fathom,MOVIE,Two biologists set out on an undertaking as colossal as their subjects—deciphering the complex communication of whales. Dr. Michelle Fournet and Dr. Ellen Garland journey to opposite hemispheres to uncover a culture eons older than our own.,2021,PG,86,['documentation'],['US'],,tt13622130,5.7,563.0,8.601,6.5
ts322544,Lincoln's Dilemma,SHOW,"Discover a side of Abraham Lincoln you’ve never seen before. In this four-part docuseries, a diverse panel of historians and rare archival materials offer a more nuanced look into the man dubbed the Great Emancipator.",2022,TV-PG,55,"['documentation', 'history']",['US'],1.0,tt17043406,7.1,375.0,6.076,7.4
ts317074,Swagger,SHOW,"Explore the world of AAU basketball in the nation’s capital, and the players, their families and coaches who walk the fine line between dreams and ambition, and opportunism and corruption.",2021,TV-14,53,"['drama', 'sport']",['US'],2.0,tt8005626,7.2,2020.0,10.777,7.913
ts312116,Amber Brown,SHOW,"Between her parents’ divorce and best friend moving away, Amber Brown is having a tough time. But her art, video diary, and new friend Brandi provide outlets for Amber to express her feelings and find gratitude in the love that surrounds her.",2022,TV-G,25,"['family', 'comedy', 'drama']",['US'],1.0,tt15514598,5.5,186.0,6.226,6.333
tm1117411,'Twas the Fight Before Christmas,MOVIE,"In this true-life twist on a holiday fable, Jeremy Morris brings a whole new meaning to Christmas spirit when his extravagant seasonal display sparks a dispute with his neighbors that lands them all in court.",2021,R,91,['documentation'],['GB'],,tt15353214,6.3,694.0,3.49,6.278
ts308042,Puppy Place,SHOW,"Charles and Lizzie Peterson have found the perfect way to foster their love of dogs — literally. The siblings take on the tough but rewarding task of fostering puppies and finding their forever homes. With every new pup, a new adventure begins.",2021,TV-G,26,[],['US'],2.0,tt15389998,7.2,86.0,3.336,9.5
tm1074442,9/11: Inside the President's War Room,MOVIE,"Experience the events of September 11, 2001 through the eyes of President Bush and his closest advisors as they personally detail the crucial hours and key decisions from that historic day.",2021,PG-13,89,"['history', 'documentation']","['GB', 'US']",,tt15010478,7.5,3091.0,8.732,6.8
tm1031102,The Year Earth Changed,MOVIE,"Never-before-seen footage shows how our living in lockdown opened the door for nature to bounce back and thrive. Across the seas, skies, and lands, Earth found its rhythm when we came to a stop.",2021,PG,48,['documentation'],"['TR', 'GB']",,tt14372240,8.2,4398.0,7.198,8.0
ts287788,"Hello, Jack! The Kindness Show",SHOW,"Preschoolers are invited into a world where a little act of kindness can change the world. Alongside special guest stars, Jack inspires kids to solve problems with kindness and heart while showcasing stories where acts of kindness are shown through “The Three C’s” – caring, connecting and cascading – from one person to another.",2021,TV-Y,22,"['family', 'comedy']",['US'],2.0,tt14676680,8.0,90.0,4.652,5.5
ts320127,Surfside Girls,SHOW,Quick wits lead to daring discoveries for beachside besties Sam and Jade as they sleuth out supernatural mysteries in their sleepy hometown of Surfside. Based on the best-selling young adult graphic novels.,2022,TV-G,30,"['thriller', 'family']",['US'],1.0,tt16390162,6.5,347.0,5.204,6.273
ts356319,Life by Ella,SHOW,"After a life-changing experience, 13-year-old Ella is eager to seize the day. As she learns to appreciate each moment, she faces the fears that once defined her—and encourages others to do the same.",2022,TV-G,30,"['drama', 'comedy']",['US'],1.0,tt20230770,5.8,152.0,4.653,7.0
ts314123,Harriet the Spy,SHOW,"Outspoken and perpetually curious. That’s 11-year-old Harriet in a nutshell. But if she’s going to be Harriet M. Welsch, future writer, she’ll need to know everything. And to know everything means she’ll need to spy…on everyone.",2021,,23,['animation'],['US'],2.0,,,,16.744,7.0
ts350046,Lovely Little Farm,SHOW,"Nestled in lavender fields is a lovely little farm where sisters Jill and Jacky nurture and love all their animals—including the talking ones. Being a young farmer isn’t easy, but every day brings adventure and a chance to grow.",2022,TV-Y,25,['family'],['US'],1.0,tt20218952,8.0,63.0,3.904,7.333
ts359674,Best Foot Forward,SHOW,"From homeschooled to the new kid in school, Josh is stepping into a whole new adventure.",2022,TV-G,0,"['family', 'comedy', 'drama']",['US'],1.0,tt20414738,7.2,199.0,4.365,5.0
tm1047516,"Who Are You, Charlie Brown?",MOVIE,"A documentary about Peanuts and its creator, Charles M. Schulz. Famous fans—including Drew Barrymore, Kevin Smith, and Al Roker—share its influence on them, and a new animated story finds Charlie Brown on a quest.",2021,G,61,"['documentation', 'animation']","['CA', 'US']",,tt14784858,7.2,558.0,6.9,6.9
ts343660,The Long Game: Bigger Than Basketball,SHOW,Makur Maker was a five-star NBA prospect headed to the Draft—until an unexpected detour led him to Howard University. This inspiring docuseries follows Makur’s journey and his determination to rewrite his story with the help of his family.,2022,TV-14,50,"['documentation', 'sport']",['US'],1.0,tt19315748,,,4.13,4.5
ts255273,The Snoopy Show,SHOW,"The world’s most iconic dog is ready for his close-up. Dive into new adventures with the happy-dancing, high-flying, big-dreaming beagle, who's joined by best friend Woodstock and rest of the Peanuts gang.",2021,TV-G,22,"['animation', 'comedy', 'family', 'action']",['US'],2.0,tt13210350,8.1,534.0,82.921,7.7
tm1210009,Snoopy Presents: Lucy's School,MOVIE,"The Peanuts gang is nervous about going to a new school, so Lucy starts her own. She soon learns that teaching is tougher than she thought—and that change can be a good thing.",2022,G,38,"['animation', 'family', 'comedy']","['US', 'CA']",,tt21405896,6.6,175.0,27.694,7.3
tm1109759,Snoopy Presents: For Auld Lang Syne,MOVIE,"After finding out her grandmother won't be visiting for Christmas, Lucy decides to cheer herself up by throwing the ultimate New Year's Eve party. Meanwhile, Charlie Brown tries to fulfill one of his resolutions before the clock strikes midnight.",2021,G,39,"['animation', 'comedy', 'family']",['CA'],,tt15553258,6.9,583.0,20.613,7.3
